Field_No,Field_Name,M_C_O,Content_to_be_Reported,Format_Pattern,Allowed_Values,XSD_Element_Path,XSD_Type_Name,Conditionality_Notes,Key_Validation_Rules,Key_Error_Codes,Source
53,Delivery Type,C,Indicates whether the derivative transaction is settled physically or in cash.,PHYS / OPTL / CASH,"PHYS (Physical delivery of the underlying); OPTL (Optional - determined by third party or at counterparty option); CASH (Cash settlement)","New/FinInstrm/Othr/DerivInstrmAttrbts/DlvryTp","PhysicalTransferType4Code","Required for derivative instruments described in the Othr block; not applicable to plain ISIN-identified instruments",,,"XSD Analysis / RTS 22"
54,Notional Currency 2 – Interest Rate Derivatives,C,"For multi-currency or cross-currency swaps and swaptions where the underlying is multi-currency: the currency of Leg 2. Mutually exclusive with Field 55.","{ISO 4217}: [A-Z]{3}",,"New/FinInstrm/Othr/DerivInstrmAttrbts/AsstClssSpcfcAttrbts/Intrst/OthrNtnlCcy","ActiveOrHistoricCurrencyCode","Required for multi-currency interest rate derivatives; use the Intrst element under AsstClssSpcfcAttrbts; mutually exclusive with Field 55","Currency 1 populated in Field 44; ISO 4217 currency code",,"XSD Analysis / RTS 22"
55,Notional Currency 2 – FX Derivatives,C,"For FX derivative contracts: the second currency of the pair. Mutually exclusive with Field 54.","{ISO 4217}: [A-Z]{3}",,"New/FinInstrm/Othr/DerivInstrmAttrbts/AsstClssSpcfcAttrbts/FX/OthrNtnlCcy","ActiveOrHistoricCurrencyCode","Required for FX derivative contracts; use the FX element under AsstClssSpcfcAttrbts; mutually exclusive with Field 54","Currency 1 populated in Field 44; ISO 4217 currency code",,"XSD Analysis / RTS 22"
56,Investment Decision Within Firm,O,"Person or algorithm within the reporting party responsible for the investment decision. Use national ID for natural persons; algorithm code for automated decision-making systems.","{NATIONAL_ID} / Algorithm ID","NATIONAL_ID: ESMA personal identification pattern (NIDN/CCPT/CONCAT); Algorithm: [A-Z0-9]{1,50}","New/InvstmtDcsnPrsn (choice: Prsn or Algo)","InvestmentParty1Choice__1","Optional; populate where a specific identified person or named algorithm within the firm was responsible","For person: CtryOfBrnch [A-Z]{2} + Othr/Id (ESMA NIDN/CCPT/CONCAT pattern) + SchmeNm (NIDN/CCPT or proprietary CONCAT); For algorithm: alphanumeric max 50 chars capital letters/numbers",,"XSD Analysis / RTS 22"
57,Country of Branch – Investment Decision Person,C,Country of branch where the person responsible for the investment decision is located.,"{ISO 3166-1 alpha-2}: [A-Z]{2}",,"New/InvstmtDcsnPrsn/Prsn/CtryOfBrnch","CountryCode","Required when Field 56 identifies a natural person; not applicable when Field 56 is an algorithm ID","ISO 3166-1 alpha-2",,"XSD Analysis / RTS 22"
58,Execution Within Firm,M,"Person or algorithm within the reporting party responsible for executing the transaction. Use NORE where the client executed the transaction directly without investment firm execution involvement.","{NATIONAL_ID} / Algorithm ID / NORE","NATIONAL_ID (NIDN/CCPT/CONCAT); Algorithm: [A-Z0-9]{1,50}; NORE (client executed directly)","New/ExctgPrsn (choice: Prsn / Algo / Clnt-NORE)","ExecutingParty1Choice__1","Mandatory for all new reports; exactly one of Person / Algorithm / Client-Direct (NORE) must be selected","For person: CtryOfBrnch + personal ID + scheme name; Algorithm: max 50 capital alphanumeric; NORE: client executed directly with no investment firm execution",,"XSD Analysis / RTS 22"
59,Country of Branch – Executing Person,C,Country of branch where the executing person is located.,"{ISO 3166-1 alpha-2}: [A-Z]{2}",,"New/ExctgPrsn/Prsn/CtryOfBrnch","CountryCode","Required when Field 58 identifies a natural person; not applicable for algorithm or NORE","ISO 3166-1 alpha-2",,"XSD Analysis / RTS 22"
60,Waiver Indicator,O,"Pre-trade transparency waiver(s) applied to the transaction. Repeatable - include one entry for each applicable waiver type.","4-char alphanumeric: [a-zA-Z0-9]{4}",,"New/AddtlAttrbts/WvrInd (element repeatable)","ReportingWaiverType1Code","Applicable where pre-trade transparency waiver was used; element may be repeated for multiple waivers","Valid codes published by the FCA; exactly 4 alphanumeric characters per code",,"XSD Analysis / RTS 22"
61,Short Selling Indicator,O,"Indicates a short sell concluded by the investment firm on its own account or on behalf of a client per Article 10 SSR.",SESH / SELL / SSEX / UNDI,"SESH (Sell Short - requires plus or zero-plus tick); SELL (Standard non-short sell); SSEX (Sell Short Exempt from SSR rules); UNDI (Side undisclosed)","New/AddtlAttrbts/ShrtSellgInd","Side5Code","Applicable where transaction is a short sell; not populated for standard buy or non-short-sell transactions",,,"XSD Analysis / RTS 22"
62,OTC Post-Trade Indicator,O,"Post-trade transparency indicator per Articles 20(3)(a) and 21(5)(a) UK MiFIR. Repeatable - include one entry per applicable indicator.","4-char alphanumeric: [a-zA-Z0-9]{4}",,"New/AddtlAttrbts/OTCPstTradInd (element repeatable)","ReportingWaiverType3Code","Applicable to OTC transactions subject to post-trade transparency reporting; element may be repeated","Valid FCA-published codes; exactly 4 alphanumeric characters",,"XSD Analysis / RTS 22"
63,Risk Reducing Transaction,O,"Indicates whether the transaction is objectively measurable as reducing risks directly relating to the commercial activity of the executing entity (relevant to non-financial counterparty hedging threshold assessment).",Boolean,"true (objectively reduces commercial activity risk); false (does not reduce commercial activity risk)","New/AddtlAttrbts/RskRdcgTx","TrueFalseIndicator","Optional; primarily relevant to non-financial counterparties assessing EMIR hedging thresholds",,,"XSD Analysis / RTS 22"
64,Securities Financing Transaction Indicator,M,"Indicates whether the transaction falls within the scope of activity to be reported under the UK Securities Financing Transactions Regulation (UK SFTR).",Boolean,"true (within UK SFTR scope); false (not within UK SFTR scope)","New/AddtlAttrbts/SctiesFincgTxInd","TrueFalseIndicator","Mandatory for ALL new transaction reports - the only field in the AddtlAttrbts block that is always required","Must always be populated; true where transaction is a repo/securities lending/margin lending/buy-sell-back within scope of UK SFTR",,,"XSD Analysis / RTS 22"
65,Field 65 – Verify Against FCA TRUP,,"The 65th field of RTS 22 Annex I could not be definitively determined from the attached XSD and partial FCA validation CSV alone. Based on some RTS 22 implementations this may relate to a reporting obligation or additional venue/instrument attribute. Refer to the complete FCA validation rules CSV and the current FCA Transaction Reporting User Pack (TRUP) for the authoritative definition of field 65.",,,,,,,"IMPORTANT: Verify Field 65 definition against the complete FCA validation rules CSV and current FCA TRUP before production implementation.","Refer to FCA TRUP","Domain Knowledge - Unconfirmed"